{
  "correctness": {
    "executed_cases": 6,
    "valid": true
  },
  "date": "2026-10-06",
  "experiment": "E16",
  "hardware": {
    "gpu_uuids": [
      "GPU-21131915-1488-23af-38dd-1743ae1f5cc8"
    ]
  },
  "limitations": [
    "Nsight Compute replay was not run for this synchronization, communication, or progress-sensitive workload."
  ],
  "protocol": {
    "matrix": {
      "cases": [
        {
          "iterations": 8,
          "size": 32
        },
        {
          "iterations": 32,
          "size": 256
        }
      ],
      "nsys_eligible": true,
      "sanitizer": "sync",
      "target": "atlas_sync"
    },
    "mode": "full"
  },
  "raw_artifacts": [
    "controller/E16-memcheck-0/artifacts",
    "controller/E16-memcheck-0/lease_receipt.json",
    "controller/E16-memcheck-0/stderr_path.txt",
    "controller/E16-memcheck-0/stdout_path.txt",
    "controller/E16-nsys-0/artifacts",
    "controller/E16-nsys-0/lease_receipt.json",
    "controller/E16-nsys-0/stderr_path.txt",
    "controller/E16-nsys-0/stdout_path.txt",
    "controller/E16-racecheck-0/artifacts",
    "controller/E16-racecheck-0/lease_receipt.json",
    "controller/E16-racecheck-0/stderr_path.txt",
    "controller/E16-racecheck-0/stdout_path.txt",
    "controller/E16-synccheck-0/artifacts",
    "controller/E16-synccheck-0/lease_receipt.json",
    "controller/E16-synccheck-0/stderr_path.txt",
    "controller/E16-synccheck-0/stdout_path.txt",
    "controller/E16-timing-0/artifacts",
    "controller/E16-timing-0/lease_receipt.json",
    "controller/E16-timing-0/stderr_path.txt",
    "controller/E16-timing-0/stdout_path.txt",
    "controller/E16-timing-1/artifacts",
    "controller/E16-timing-1/lease_receipt.json",
    "controller/E16-timing-1/stderr_path.txt",
    "controller/E16-timing-1/stdout_path.txt",
    "controller/E16-verify-0/artifacts",
    "controller/E16-verify-0/lease_receipt.json",
    "controller/E16-verify-0/stderr_path.txt",
    "controller/E16-verify-0/stdout_path.txt",
    "controller/E16-verify-1/artifacts",
    "controller/E16-verify-1/lease_receipt.json",
    "controller/E16-verify-1/stderr_path.txt",
    "controller/E16-verify-1/stdout_path.txt"
  ],
  "result_summary": "6 case(s); correctness passed",
  "samples": [
    {
      "checks": {
        "valid": true
      },
      "configuration": {
        "rounds": "8",
        "tasks": "32",
        "termination": "all assigned tasks drained; kernel exits after final grid phase"
      },
      "experiment": "E16",
      "limitations": [],
      "metrics": {
        "admitted_blocks": 1,
        "latency_ms_median": 0.014336000196635723,
        "latency_ms_p95": 0.015359999611973763,
        "stopped": 1,
        "sum": 528
      },
      "raw_sample_counts": {
        "latency_ms": 30
      },
      "status": "GPU_RUN",
      "variant": "cooperative_resident"
    },
    {
      "checks": {
        "valid": true
      },
      "configuration": {
        "termination": "one finite kernel per batch; no global spin barrier"
      },
      "experiment": "E16",
      "limitations": [],
      "metrics": {
        "latency_ms_median": 0.0071680000983178616,
        "latency_ms_p95": 0.0071680000983178616,
        "sum": 528
      },
      "raw_sample_counts": {
        "latency_ms": 30
      },
      "status": "GPU_RUN",
      "variant": "batched"
    },
    {
      "checks": {
        "valid": true
      },
      "configuration": {
        "termination": "captured memset plus finite batch kernel"
      },
      "experiment": "E16",
      "limitations": [],
      "metrics": {
        "latency_ms_median": 0.0071680000983178616,
        "latency_ms_p95": 0.0071680000983178616,
        "sum": 528
      },
      "profiles": {
        "nsys": {
          "gpu_memtime_rows": 0,
          "gpu_memtimes_csv": null,
          "report": "/home/tumlinson/gpu_circuit_bending_atlas/.todo-orchestrator/runtime/background-artifacts/foreground/1a1c5d8c-5431-454f-a5a4-1870e0b4b5f7/nsys/run/report.nsys-rep",
          "report_bytes": 259750,
          "sqlite_activity_counts": {
            "kernels": 72,
            "memcpy": 5,
            "memset": 108
          },
          "sqlite_activity_rows": 185,
          "sqlite_path": "/home/tumlinson/gpu_circuit_bending_atlas/.todo-orchestrator/runtime/background-artifacts/foreground/1a1c5d8c-5431-454f-a5a4-1870e0b4b5f7/nsys/run/report.sqlite",
          "sqlite_problem": null,
          "summary": {
            "api_signals": {
              "launch_calls": 37.0,
              "launch_pct": 6.69592741006178,
              "malloc_free_pct": 12.731118363826956,
              "memcpy_memset_pct": 18.247199072181044
            },
            "bottleneck_hints": [
              "host-device-traffic"
            ],
            "measurement_scope": "timeline and setup behavior",
            "needs_rerun_for_timing": true,
            "next_step": "Keep data resident and rerun after removing steady-state transfer traffic.",
            "notes": [
              "Use Nsight Systems to decide whether the benchmark reflects steady-state behavior or mostly setup and transfer costs.",
              "Use benchmark output for throughput numbers. Use Nsight Compute for kernel cause, not timeline validity."
            ],
            "reasons": [
              "Memcpy or memset activity is material (18.2% of CUDA API time). Host-device traffic may be distorting end-to-end timing."
            ],
            "recommended_route": "pipeline",
            "recommended_route_reason": "Memcpy or memset activity is large enough to route into pipeline repair first.",
            "status": "partial",
            "steady_state_timing_valid": false,
            "tool": "nsys",
            "top_kernels": [
              {
                "avg_us": 7.9066,
                "instances": 36,
                "name": "<unnamed>::resident_work(unsigned long long *, int, int, int *)",
                "time_pct": 84.9,
                "total_ms": 0.284637
              },
              {
                "avg_us": 1.4089,
                "instances": 36,
                "name": "<unnamed>::batched_work(unsigned long long *, int)",
                "time_pct": 15.1,
                "total_ms": 0.05072
              }
            ],
            "trace_valid": true
          },
          "trace_has_gpu_work": true
        }
      },
      "raw_sample_counts": {
        "latency_ms": 30
      },
      "status": "GPU_RUN",
      "variant": "graph_replay"
    },
    {
      "checks": {
        "valid": true
      },
      "configuration": {
        "rounds": "32",
        "tasks": "256",
        "termination": "all assigned tasks drained; kernel exits after final grid phase"
      },
      "experiment": "E16",
      "limitations": [],
      "metrics": {
        "admitted_blocks": 2,
        "latency_ms_median": 0.035840000957250595,
        "latency_ms_p95": 0.03686400130391121,
        "stopped": 1,
        "sum": 32896
      },
      "raw_sample_counts": {
        "latency_ms": 30
      },
      "status": "GPU_RUN",
      "variant": "cooperative_resident"
    },
    {
      "checks": {
        "valid": true
      },
      "configuration": {
        "termination": "one finite kernel per batch; no global spin barrier"
      },
      "experiment": "E16",
      "limitations": [],
      "metrics": {
        "latency_ms_median": 0.0071680000983178616,
        "latency_ms_p95": 0.0071680000983178616,
        "sum": 32896
      },
      "raw_sample_counts": {
        "latency_ms": 30
      },
      "status": "GPU_RUN",
      "variant": "batched"
    },
    {
      "checks": {
        "valid": true
      },
      "configuration": {
        "termination": "captured memset plus finite batch kernel"
      },
      "experiment": "E16",
      "limitations": [],
      "metrics": {
        "latency_ms_median": 0.0071680000983178616,
        "latency_ms_p95": 0.0071680000983178616,
        "sum": 32896
      },
      "raw_sample_counts": {
        "latency_ms": 30
      },
      "status": "GPU_RUN",
      "variant": "graph_replay"
    }
  ],
  "software": {
    "tools": {
      "compute_sanitizer": {
        "path": "/opt/nvidia/hpc_sdk/Linux_x86_64/26.1/cuda/12.9/compute-sanitizer/compute-sanitizer",
        "returncode": 0,
        "stderr": "",
        "stdout": "NVIDIA (R) Compute Sanitizer\nCopyright (c) 2020-2025 NVIDIA Corporation\nVersion 2025.2.1.0 (build 35969825) (public-release)"
      },
      "ncu": {
        "path": "/opt/nvidia/hpc_sdk/Linux_x86_64/26.1/profilers/12.9/Nsight_Compute/ncu",
        "returncode": 0,
        "stderr": "",
        "stdout": "NVIDIA (R) Nsight Compute Command Line Profiler\nCopyright (c) 2018-2025 NVIDIA Corporation\nVersion 2025.2.1.0 (build 35987062) (public-release)"
      },
      "nsys": {
        "path": "/opt/nvidia/hpc_sdk/Linux_x86_64/26.1/profilers/12.9/Nsight_Systems_2025.3/bin/nsys",
        "returncode": 0,
        "stderr": "",
        "stdout": "NVIDIA Nsight Systems version 2025.3.1.90-253135822126v0"
      },
      "nvcc": {
        "path": "/opt/nvidia/hpc_sdk/Linux_x86_64/26.1/cuda/12.9/bin/nvcc",
        "returncode": 0,
        "stderr": "",
        "stdout": "nvcc: NVIDIA (R) Cuda compiler driver\nCopyright (c) 2005-2025 NVIDIA Corporation\nBuilt on Tue_May_27_02:21:03_PDT_2025\nCuda compilation tools, release 12.9, V12.9.86\nBuild cuda_12.9.r12.9/compiler.36037853_0"
      }
    }
  },
  "source_hashes": {
    "files_sha256": "318510f3097352432ccce8d38af7b1a95403d63d3acafaa8f7fd514ec2c124f2",
    "tree_sha256": "5bacf9f34b437045719772d65b47a2a4767e910373ed6413f6766d24c42ae80c"
  },
  "status": "GPU_RUN"
}
